{"schema":"prism.cli.compare_result.a1","base":{"revision_key":"d59a758370bd428e43a3482505c9273caa9a12353345fbc2fe5f3db8e8de0e07","bundle_key":"d59a758370bd428e43a3482505c9273caa9a12353345fbc2fe5f3db8e8de0e07","objects":1200},"head":{"revision_key":"0980ee7d3cc2cca05c0fb547aa0bf550aa174ddeffad8ea54eba3d8cd61cfdc1","bundle_key":"0980ee7d3cc2cca05c0fb547aa0bf550aa174ddeffad8ea54eba3d8cd61cfdc1","objects":1210},"counts":{"schematic":{"added":2,"removed":0,"changed":3},"pcb":{"added":14,"removed":4,"changed":9},"bom":{"added":1,"removed":0,"changed":2}}}